<?xml version="1.0" encoding="UTF-8" ?>

<students xmlns:xsi="http://www.w3.org/2001/XMLSchema-instance"
	 xsi:noNamespaceSchemaLocation="test3.xsd">
	<student>
		<name>war</name>
		<age>18</age>
		<sex>male</sex>
	</student>
	
	<student >
		<name>fox</name>
		<age>18</age>
		<sex>female</sex>
	</student>
</students>